{
  "schema_version": "1.0.0",
  "execution_receipt_id": "sha256:5214c63927769a3a0276df198a6d8f9b1e188a166fef392f484841fdaa3c8be0",
  "repository_id": "repo:example/codex-governed-change",
  "candidate_id": "sha256:aaaaaaaaaaaaaaaaaaaaaaaaaaaaaaaaaaaaaaaaaaaaaaaaaaaaaaaaaaaaaaaa",
  "input_context_receipt_sha256": "sha256:1717171717171717171717171717171717171717171717171717171717171717",
  "projection_sha256": "sha256:1111111111111111111111111111111111111111111111111111111111111111",
  "review_mode": "conformance",
  "reviewer_output_sha256": "sha256:8888888888888888888888888888888888888888888888888888888888888888",
  "model": "gpt-5.6-sol",
  "reasoning_effort": "xhigh",
  "retrieval_expansions": [],
  "usage_observed": true,
  "input_tokens": 2400,
  "cached_input_tokens": 1200,
  "output_tokens": 400,
  "reasoning_output_tokens": 200,
  "latency_ms": 12500,
  "cost": "unavailable",
  "created_at": "2026-08-26T12:45:00Z",
  "limitations": ["Unsigned local example; not admission evidence."]
}
